{
  "$schema": "https://json-schema.org/draft/2020-12/schema",
  "$id": "https://newsdash.invalid/schema/site.schema.json",
  "title": "Relevance site config",
  "type": "object",
  "required": ["schema_version", "title", "visibility", "languages", "default_language", "theme", "timezone"],
  "additionalProperties": false,
  "properties": {
    "$schema": { "type": "string" },
    "schema_version": { "const": 1 },
    "title": {
      "description": "Site masthead. A plain string is used for every language; an {en, zh} object lets each language have its own title (at least one key required).",
      "anyOf": [
        { "type": "string", "minLength": 1, "maxLength": 120 },
        {
          "type": "object",
          "additionalProperties": false,
          "minProperties": 1,
          "properties": {
            "en": { "type": "string", "minLength": 1, "maxLength": 120 },
            "zh": { "type": "string", "minLength": 1, "maxLength": 120 }
          }
        }
      ]
    },
    "subtitle": {
      "description": "Optional tagline under the masthead. String or {en, zh}, same convention as title.",
      "anyOf": [
        { "type": "string", "maxLength": 200 },
        {
          "type": "object",
          "additionalProperties": false,
          "minProperties": 1,
          "properties": {
            "en": { "type": "string", "maxLength": 200 },
            "zh": { "type": "string", "maxLength": 200 }
          }
        }
      ]
    },
    "visibility": { "enum": ["public", "private"] },
    "languages": {
      "type": "array",
      "items": { "enum": ["en", "zh"] },
      "minItems": 1,
      "uniqueItems": true
    },
    "default_language": { "enum": ["en", "zh"] },
    "theme": {
      "enum": ["the-type", "papermod", "blowfish", "nyt", "bear"],
      "description": "Default theme. 'nyt' and 'bear' are deprecated aliases of 'papermod' and 'blowfish' respectively — they still validate and are auto-mapped to the new keys at load time."
    },
    "timezone": { "type": "string", "minLength": 1 },
    "windows": {
      "type": "object",
      "additionalProperties": false,
      "properties": {
        "news_hours": { "type": "integer", "minimum": 1, "maximum": 168 },
        "papers_days": { "type": "integer", "minimum": 1, "maximum": 60 },
        "archive_days": { "type": "integer", "minimum": 1, "maximum": 90 }
      }
    },
    "ranking": {
      "type": "object",
      "additionalProperties": false,
      "properties": {
        "highlights": { "type": "boolean" },
        "max_per_source": { "type": "integer", "minimum": 1 }
      }
    },
    "threads": {
      "type": "object",
      "additionalProperties": false,
      "properties": {
        "enabled": { "type": "boolean" },
        "max_threads": { "type": "integer", "minimum": 2, "maximum": 6 },
        "include_private": { "type": "boolean" }
      }
    },
    "sections": {
      "type": "array",
      "items": {
        "type": "object",
        "additionalProperties": false,
        "required": ["id", "label"],
        "properties": {
          "id": { "type": "string", "pattern": "^[a-z0-9_-]{2,32}$" },
          "label": {
            "type": "object",
            "additionalProperties": false,
            "minProperties": 1,
            "properties": {
              "en": { "type": "string", "minLength": 1 },
              "zh": { "type": "string", "minLength": 1 }
            }
          },
          "order": { "type": "integer" },
          "kind": { "enum": ["news", "papers"] }
        }
      }
    }
  }
}
