{
  "$schema": "./schema/site.schema.json",
  "schema_version": 1,
  "title": "Relevance",
  "subtitle": "",
  "visibility": "public",
  "languages": [
    "en",
    "zh"
  ],
  "default_language": "en",
  "theme": "the-type",
  "timezone": "America/Chicago",
  "windows": {
    "news_hours": 24,
    "papers_days": 7,
    "archive_days": 14
  }
}
